{"files":[{"path":".gitattributes","sha256":"11ad7efa24975ee4b0c3c3a38ed18737f0658a5f75a0a96787b576a78a023361","size":1519},{"path":"LICENSE.txt","sha256":"0b4284c1f87029e67654c7953afa16279961632cf73dcfe33374c4c2f298fa35","size":7712},{"path":"README.md","sha256":"8cea167f3aa4dbeea16d32caf6e446184e7e9aa9ebae7de6e3259ea049874570","size":41744},{"path":"USE_POLICY.md","sha256":"40e2777d7faa6beaf98400654170f414d8ab29b921b5163ad4ea0a1d39894201","size":6021},{"path":"config.json","sha256":"39fb36dc5416f445ebc4e71cb71fbcf6727e80a35836d8ba1a1474c318467b7a","size":878},{"path":"generation_config.json","sha256":"88effbb63300dbbc7390143fbbdd9d9fa50587b37e8bfd16c8c90d4970a74a36","size":189},{"path":"model-00001-of-00002.safetensors","sha256":"13cbd6d16e927a0c5bad54102514e6e18b4a47b3a6eb911e39d678d328d19f55","size":4965799096},{"path":"model-00002-of-00002.safetensors","sha256":"7b770216613ac5c34d7c54bdff1fa616bc4e338a9d0b20af6303e48c295ee23c","size":1459729952},{"path":"model.safetensors.index.json","sha256":"0a57c30afc07c81610ae7fe013bea3b9d50365f9a8145ae98e8714220f3d7c7c","size":20919},{"path":"original/consolidated.00.pth","sha256":"dd817d4653a88601bac65e39ae7446ead3988264afafbce48559d5b5359044d6","size":6425585114},{"path":"original/orig_params.json","sha256":"0aa31c4da011c8cb7ab8d40dfe4402971426063038f622001e34008ce452e953","size":220},{"path":"original/params.json","sha256":"0aa31c4da011c8cb7ab8d40dfe4402971426063038f622001e34008ce452e953","size":220},{"path":"original/tokenizer.model","sha256":"82e9d31979e92ab929cd544440f129d9ecd797b69e327f80f17e1c50d5551b55","size":2183982},{"path":"special_tokens_map.json","sha256":"6f38c73729248f6c127296386e3cdde96e254636cc58b4169d3fd32328d9a8ec","size":296},{"path":"tokenizer.json","sha256":"79e3e522635f3171300913bb421464a87de6222182a0570b9b2ccba2a964b2b4","size":9085657},{"path":"tokenizer_config.json","sha256":"9823dcfdc1121869029da45192238e85cf44f0b232a6d9dc20e4fe6f4242a14e","size":54528}],"model_id":"meta-llama/Llama-3.2-3B-Instruct","revision":"0cb88a4f764b7a12671c53f0838cd831a0843b95","schema_version":"1","tokenizer_id":"meta-llama/Llama-3.2-3B-Instruct","tokenizer_revision":"0cb88a4f764b7a12671c53f0838cd831a0843b95","total_size":12862518047}
