{"files":[{"path":"config.json","sha256":"5beea1a4a34c62782bfb2f911c606741a3bab8f92d80a118fa053c28af12e8ba","size":727},{"path":"generation_config.json","sha256":"835fffe355c9438e7a25be099b3fccaa98350b83451f9fd2d99512e74f1ade48","size":238},{"path":"merges.txt","sha256":"599bab54075088774b1733fde865d5bd747cbcc7a547c5bc12610e874e26f5e3","size":1671839},{"path":"model-00001-of-00003.safetensors","sha256":"75311d91bb08cf0b882913da464a1e722a31fb44db35208663487efb7a3d8ed6","size":3957900840},{"path":"model-00002-of-00003.safetensors","sha256":"0b48adbb1f60e901153d91907ba11ce63bd4b8b584482e730f48808d055dfba1","size":3987450520},{"path":"model-00003-of-00003.safetensors","sha256":"7dd39ccca5e4de123c74c14af44c9bf2eb75df33b4614382af0134528e060d5d","size":99630640},{"path":"model.safetensors.index.json","sha256":"d6c42883a895dfef5b0080ed2116a1bcd764f558406b98923d675978a1abf29c","size":32819},{"path":"tokenizer.json","sha256":"aeb13307a71acd8fe81861d94ad54ab689df773318809eed3cbe794b4492dae4","size":11422654},{"path":"tokenizer_config.json","sha256":"a5036bfb48523661f15d50c664e8dfc0e9b0b4c9a20eba3180782d52a1b94a8d","size":10824},{"path":"vocab.json","sha256":"ca10d7e9fb3ed18575dd1e277a2579c16d108e32f27439684afa0e10b1440910","size":2776833}],"model_id":"Qwen/Qwen3-4B-Instruct-2507","revision":"eb25fbe4f35f7147763bc24445679d1c00588d89","schema_version":"1","tokenizer_id":"Qwen/Qwen3-4B-Instruct-2507","tokenizer_revision":"eb25fbe4f35f7147763bc24445679d1c00588d89","total_size":8060897934}
